{
  "script_id": "01001012",
  "title": "黄鹤楼",
  "model": {
    "method": "nmf",
    "num_topics_global": 4,
    "trained_at": "2026-06-02T04:42:32.829035+00:00"
  },
  "topics": [
    {
      "topic_id": 0,
      "label": "忠君奉旨",
      "weight": 0.5123,
      "keywords": [
        "过江",
        "君臣",
        "东吴",
        "逃走",
        "老张",
        "迎接",
        "回朝",
        "追赶",
        "奸计",
        "保驾",
        "好意",
        "染病",
        "探病",
        "饮宴",
        "下楼"
      ],
      "keyword_weights": [
        1.7082,
        1.513,
        0.7767,
        0.1528,
        0.1192,
        0.1136,
        0.1133,
        0.0864,
        0.0703,
        0.0683,
        0.0663,
        0.0628,
        0.0593,
        0.059,
        0.0576
      ]
    },
    {
      "topic_id": 1,
      "label": "宴饮场面",
      "weight": 0.3053,
      "keywords": [
        "周郎",
        "竹节",
        "小儿",
        "打开",
        "言语",
        "令箭",
        "国文",
        "写下",
        "长坂坡",
        "曹兵",
        "子龙",
        "看来",
        "待臣",
        "埋伏",
        "暗有"
      ],
      "keyword_weights": [
        1.7668,
        0.2527,
        0.159,
        0.1224,
        0.1172,
        0.1077,
        0.0743,
        0.0708,
        0.0643,
        0.0544,
        0.0508,
        0.0442,
        0.0439,
        0.0388,
        0.0388
      ]
    },
    {
      "topic_id": 2,
      "label": "出使行程",
      "weight": 0.1824,
      "keywords": [
        "皇叔",
        "恕罪",
        "请来",
        "荆州",
        "进宫",
        "饮宴",
        "赤壁鏖兵",
        "战船",
        "想当年",
        "长江",
        "诸葛",
        "奇功",
        "弟兄",
        "三顾茅庐",
        "孔明"
      ],
      "keyword_weights": [
        2.0833,
        0.1169,
        0.1079,
        0.0896,
        0.0671,
        0.0591,
        0.0476,
        0.0439,
        0.0427,
        0.0061,
        0.0037,
        0.0034,
        0.0032,
        0.0032,
        0.0025
      ]
    }
  ],
  "topic_composition": [
    0.5123,
    0.3053,
    0.1824
  ],
  "representative_blocks": [
    {
      "topic_id": 0,
      "block_id": "b_99",
      "block_index": 99,
      "text_snippet": "招孤灵魂入庙堂。",
      "context_snippet": "倘若我命东吴丧，  /  » 招孤灵魂入庙堂。  /  孤去便去，多带能将保驾才是。",
      "speaker_id": "c_刘备",
      "speaker_name": "刘备",
      "score": 1.0
    },
    {
      "topic_id": 0,
      "block_id": "b_95",
      "block_index": 95,
      "text_snippet": "倒叫孤王无主张。",
      "context_snippet": "他二人把话一样讲，  /  » 倒叫孤王无主张。  /  回言便与先生讲，",
      "speaker_id": "c_刘备",
      "speaker_name": "刘备",
      "score": 1.0
    },
    {
      "topic_id": 1,
      "block_id": "b_87",
      "block_index": 87,
      "text_snippet": "难道你也怕周郎？",
      "context_snippet": "先生。  /  » 难道你也怕周郎？  /  先生，",
      "speaker_id": "c_诸葛亮",
      "speaker_name": "诸葛亮",
      "score": 1.0
    },
    {
      "topic_id": 1,
      "block_id": "b_79",
      "block_index": 79,
      "text_snippet": "孙刘结仇山海样，",
      "context_snippet": "休提起当年赴会在河梁。  /  » 孙刘结仇山海样，  /  孤岂肯把性命送入虎狼？",
      "speaker_id": "c_刘备",
      "speaker_name": "刘备",
      "score": 1.0
    },
    {
      "topic_id": 2,
      "block_id": "b_287",
      "block_index": 287,
      "text_snippet": "皇叔你此言差矣。",
      "context_snippet": "» 皇叔你此言差矣。  /  哦，我又差了？",
      "speaker_id": "c_周瑜",
      "speaker_name": "周瑜",
      "score": 1.0
    },
    {
      "topic_id": 2,
      "block_id": "b_274",
      "block_index": 274,
      "text_snippet": "吓，皇叔，瑜有一言奉告，只是难以启齿。",
      "context_snippet": "啊啊啊，哈哈哈……  /  » 吓，皇叔，瑜有一言奉告，只是难以启齿。  /  都督有何金言，当面请讲。",
      "speaker_id": "c_周瑜",
      "speaker_name": "周瑜",
      "score": 1.0
    }
  ]
}
